Priority,Component/Layer,Issue,Assessment/Recommendation
Critical,analyze_study_logs.py,within_30s row-flagging loop,"Correct and NOT definitively buggy. Python's negative indexing relative to the end of the list works perfectly here. rows[-n_edits] always dynamically points to the first item of the most recently appended batch, so it never overwrites previous sessions."
Critical,VerifierReasoningPanel,"Synthetic Node IDs (step_3, step_7)","Skip the PUSH entirely when kg_nodes = []. Pushing a synthetic ID pollutes the concept array with non-semantic data that fails fuzzy string matching. Track interaction timestamps separately if needed for H1."
Medium,RubricEditorPanel,Click-to-Add Inflation of H2,"Include but flag with interaction_source, and analyze separately. Click-to-Add is assisted semantic alignment. Mixing them inflates unprompted alignment, so analyze 'manual' vs 'click_to_add' separately."
Medium,studyLogger,Cleaner TypeScript Pattern for logEvent,"Use generics to make logEvent strongly typed (e.g., export function logEvent<T extends Record<string, any>>(...)). This avoids the 'as unknown as Record<string, unknown>' double-cast that hides errors."
Low,conceptAliases.ts,Layer 2 Ordering and Fallback,"Logically sound and does not need re-ordering. Both Layer 2 checks contain return statements and exit immediately. The Kaggle ASAG fallback correctly resolves alias matches without producing false positives."
